doi,key,title,year,month,day,journal,issn,volume,issue,pages,authors,url,language,publisher,location,abstract,notes,keywords,pubmed_id,pmc_id,screener
10.1046/j.1439-0310.2003.00876.x,rayyan-471509393,Amarillo fish (Girardinichthys multiradiatus) use visual landmarks to orient in space,2003,4,NA,ETHOLOGY,0179-1613,109,4,341-350,"de Perera, TB and Garcia, CM",NA,NA,NA,NA,"Fish responsiveness to visual stimuli has been studied extensively in contexts such as female mate choice, predator inspection and schooling, yet surprisingly little work has been conducted on visual orientation in space in fish. Here we report on an experiment designed to test whether Amarillo fish can learn to find a goal within a maze more effectively in the presence of local visual landmarks than otherwise. We found that: (a) Amarillo fish can use landmarks to locate a goal, (b) there was no observed difference in the ability to use visual landmarks between two populations and (c) overall navigational performance differed between two populations of Amarillo fish: individuals from a permanently turbid eutrophic pond performed better than those from a pond with clear waters. We hypothesize that fish that inhabit clear waters possess poorer navigational capabilities than fish from turbid waters because they normally rely on goal-oriented behaviour, which requires neither egocentric nor environmental clues to navigate. This paper adds to the literature on the links between habitat characteristics and population differences in performance. | WoS_03_DaviesEtAlOriginalRayyanFormatted.csv",NA,NA,NA,NA,Aleksandra
10.1006/jtbi.1995.0097,rayyan-471522079,Delayed breeding and the evolution of mate copying in lekking species,1995,NA,NA,Journal of Theoretical Biology,NA,174,3,261 - 267,"Dugatkina, Lee Alan and HöGlund Rauno, Jacob",https://www.scopus.com/inward/record.uri?eid=2-s2.0-0028989756&doi=10.1006%2Fjtbi.1995.0097&partnerID=40&md5=d1ff851b52ab9905cab7b6c3aaa984b2,NA,NA,NA,"Recent experimental evidence indicates that females may copy the mate choice of others. Here, we present a model for the evolution of mate copying strategies in lekking species. In the model, all females (copiers and non-copiers) assess male quality, but a copier's assessment of a male's quality increases after males have mated with other females. The model demonstrates that mate copying is favored when breeding late in the season has a relatively high cost. We hope that our results will spur empirical work quantifying the time constraints associated with breeding; thus allowing more direct tests of the model's predictions. © 1995 Academic Press. | SCO_04_DaviesEtAlOriginalRayyanFormatted.csv; WoS_01_JonesDuvalOriginalRayyanFormatted.csv; WoS_03_DaviesEtAlOriginalRayyanFormatted.csv",Cited by: 22,delayed breeding; lekking; mate choice; mate copying; breeding; female; male; model; season; species,NA,NA,Aleksandra
10.16719/j.cnki.1671-6981.20210424,rayyan-471521475,Love the Love of Other Men: Male’s Mate-Choice Copying under the Activation of Mating Motives; 君子不夺人所好？择偶动机启动下的男性择偶复制,2021,NA,NA,Journal of Psychological Science,NA,44,4,940 - 946,"Chen, Yunyun and Wang, Yuying and Guo, Sen and Zhang, Yajing and Yan, Bihua",https://www.scopus.com/inward/record.uri?eid=2-s2.0-105019808805&doi=10.16719%2Fj.cnki.1671-6981.20210424&partnerID=40&md5=7d9f7061aeb3dffa54e2beac5168192a,NA,NA,NA,"A lot of studies find that females, including non-human females, do not select male partners independently. This phenomenon is termed as mate-choice copying. Mate-choice copying refers to the phenomenon that the probability of a target partner being chosen or rejected is influenced by the attitudes of other persons of the same sex. Therefore, mate-choice copying is considered to be a non-independent form of mate selection strategy, which is affected by the additional information provided by individuals of the same sex in the process of sexual selection. This method is useful to reduce the loss caused by poor mate selection when information is limited, and it can also save a lot of time and energy during mate selection. However, previous studies disagree about whether males’ mate-choice copying would occur. Mating motive is a psychological ideology, in which an individual wants to establish an intimate relationship with the partner of the opposite sex. The activation of mating motive can change people's behavioral decisions. For example, when males’ mating motives are activated, they will show more competitive behaviors, lower risk aversion behaviors, and more risk-taking behaviors. At the same time, the activation of mating motives also strengthens males’ attentional biases to highly attractive females’ faces. Therefore, the present study mainly focused on the influence of mating motive and the levels of facial attraction of a potential partner on the occurrence of mate-choice copying of males. Experiment 1 aimed to investigate whether the mating motives were activated or not would have different influences on the mate-choice copying between different sexes. Experiment 2 was designed to explore the effects of the different levels of female facial attraction and activation of mating motive on males’ mate-choice copying. The results show as follows: (1) Females’ mate-choices are usually influenced by the attitudes of others from the same sex group, regardless whether their mating motives are activated. However, males’ mate-choices are often independent of other males’ choices when their mating motives are not activated. (2) When mating motives are activated, males’ mate-choice is more susceptible to the influence of other male’s attitudes. They will choose the female selected by other males, and reject the female rejected by other males. However, this influence of other males’ attitudes in such case on males’ mate-choices is limited to the situation when facial attraction of female is in low and middle level. When the potential spouse or girlfriend’s facial attraction is in high level, even though males’ mating motives are activated, they are still attracted by the highly attractive female regardless of other males’ attitudes. Our results provide a new explanation for the disputes about the differences of mate-choice copying between different genders. In detail, there is mate-choice copying with females’ mate-choices for the needs of rapid decision and risk reduction of sexual selection. However, males’ mate-choice copying is usually dependent on complicated factors. The effects of mating motive activation on male’s and female’s mate-choice copying, and the modulating effect of females’ facial attraction on males’ mate-choice copying were discussed. © 2021 Chinese Psycholocial Society. All rights reserved. | SCO_04_DaviesEtAlOriginalRayyanFormatted.csv",Cited by: 0,NA,NA,NA,Aleksandra
10.1111/j.1420-9101.2008.01568.x,rayyan-471521906,Sexual imprinting on continuous variation: Do female zebra finches prefer or avoid unfamiliar sons of their foster parents?,2008,NA,NA,Journal of Evolutionary Biology,NA,21,5,1274 - 1280,"Schielzeth, Holger and Burger, Claudia and Bolund, Elisabeth and Forstmeier, Wolfgang",https://www.scopus.com/inward/record.uri?eid=2-s2.0-49549088311&doi=10.1111%2Fj.1420-9101.2008.01568.x&partnerID=40&md5=f96aac8bf3c70e3b8bf4cdd5b25b74ec,NA,NA,NA,"Sexual imprinting on discrete variation that serves the identification of species, morphs or sexes is well documented. By contrast, sexual imprinting on continuous variation leading to individual differences in mating preferences within a single species, morph and sex has been studied only once (in humans). We measured female preferences in a captive population of wild-type zebra finches. Individual cross-fostering ensured that all subjects grew up with unrelated foster parents and nest mates. Females from two cohorts (N = 113) were given a simultaneous choice between (two or four) unfamiliar males, one of which was a genetic son of their foster parents (SFP). We found no significant overall preference for the SFP (combined effect size d = 0.14 ± 0.15). Additionally, we tested if foster parent traits could potentially explain between-female variation in preferences. However, neither the effectiveness of cooperation between the parents nor male contribution to parental care affected female preferences for the son of the foster father. We conclude that at least in zebra finches sexual imprinting is not a major source of between-individual variation in mating preferences. © 2008 The Authors. | SCO_04_DaviesEtAlOriginalRayyanFormatted.csv",Cited by: 27; All Open Access; Bronze Open Access,captive population; female behavior; imprinting; inbreeding avoidance; individual variation; kin ...;Animal; Paternal Behavior; Phenotype; Taeniopygia guttata,NA,NA,Aleksandra
10.1016/j.cub.2009.03.016,rayyan-471521874,Social Learning: What Do Drosophila Have to Offer?,2009,NA,NA,Current Biology,NA,19,9,R378 - R380,"Leadbeater, Ellouise",https://www.scopus.com/inward/record.uri?eid=2-s2.0-65449116407&doi=10.1016%2Fj.cub.2009.03.016&partnerID=40&md5=3442aa9573cb8c69c74c50e15d8a4300,NA,NA,NA,The recent finding that female Drosophila copy the mate-choice criteria of other females introduces a mainstream model species to the study of how animals use social information. © 2009 Elsevier Ltd. All rights reserved. | SCO_04_DaviesEtAlOriginalRayyanFormatted.csv; WoS_01_JonesDuvalOriginalRayyanFormatted.csv; WoS_03_DaviesEtAlOriginalRayyanFormatted.csv,Cited by: 14; All Open Access; Bronze Open Access,animal; decision making; Drosophila melanogaster; evolution; female; imitation; perception; physi...;Animal; Social Perception; Animalia,NA,NA,Aleksandra
10.1145/3744249,rayyan-471521386,Generation and Editing of Mandrill Faces: Application to Sex Editing and Assessment,2025,NA,NA,"ACM Transactions on Multimedia Computing, Communications and Applications",NA,21,8,NA,"Dibot, Nicolas M. and Renoult, Julien Pierre and Puech, William",https://www.scopus.com/inward/record.uri?eid=2-s2.0-105018471711&doi=10.1145%2F3744249&partnerID=40&md5=f329edff51b06f274affec006a6c0ecf,NA,NA,NA,"Generative AI has seen major developments in recent years, enhancing the realism of synthetic images, also known as computer-generated images. In addition, generative AI has also made it possible to modify specific image characteristics through image editing. Previous work has developed methods based on generative adversarial networks (GANs) for generating realistic images, in particular faces, but also to modify specific features. However, this work has never been applied to specific animal species. Moreover, the assessment of the results has been generally done subjectively, rather than quantitatively. In this article, we propose an approach based on methods for generating images of faces of male or female mandrills, a non-human primate. The main novelty of proposed method is the ability to edit their sex by identifying a sex axis in the latent space of a specific GAN. In addition, we have developed an assessment of the sex levels based on statistical features extracted from real image distributions. The experimental results we obtained from a specific database are not only realistic, but also accurate, meeting a need for future work in behavioral experiments with wild mandrills. © 2025 Copyright held by the owner/author(s). | SCO_04_DaviesEtAlOriginalRayyanFormatted.csv; WoS_03_DaviesEtAlOriginalRayyanFormatted.csv",Cited by: 0; All Open Access; Green Accepted Open Access; Green Open Access,Behavioral research; Ecology; Generative adversarial networks; Human engineering; Image enhanceme...,NA,NA,Aleksandra
10.1016/j.anbehav.2020.06.002,rayyan-471521506,"Behavioural flexibility in the courtship dance of golden-collared manakins, Manacus vitellinus",2020,NA,NA,Animal Behaviour,NA,166,NA,61 - 71,"Janisch, Judith and Perinot, Elisa and Fusani, Leonida",https://www.scopus.com/inward/record.uri?eid=2-s2.0-85087298721&doi=10.1016%2Fj.anbehav.2020.06.002&partnerID=40&md5=e59cadb03c21a1f6c37d044f6468eef3,NA,NA,NA,"Courtship displays have been traditionally considered stereotyped behaviours. Many elaborate courtships are displayed in specific locations or in courts prepared by the displaying individuals. Sudden environmental events may alter the spatial structure of the displaying site, and individuals should be able to cope with such disruptions. In some mating systems, courtship is the only or main trait used in mate choice. This is the case in lek mating systems where male mating success is highly skewed and intense sexual selection may drive the evolution of elaborate courtship. The golden-collared manakin is a lekking species of the Neotropical forests. Males have an elaborate courtship display that includes a series of acrobatic jumps within a court delimited by small saplings. The courtship ends with a jump on one of the saplings, called the mating sapling, which invites the female to copulate. The display of each male follows a consistent routine that males establish at the beginning of the reproductive season. We hypothesized that males possess behavioural flexibility to adapt their courtship behaviour to unpredictable environmental changes. We investigated the effects of a sudden disruption of the court configuration by placing a piece of bark on the mating sapling. Males gradually established a new display sequence with an alternative mating sapling, demonstrating a high level of behavioural flexibility that suggests the involvement of motor learning. When the bark was removed, some males reverted to the original sequence, showing retention of the original display sequence. Our study provides evidence for the involvement of motor learning in the establishment and adjustment of elaborate courtship displays. © 2020 The Authors | SCO_04_DaviesEtAlOriginalRayyanFormatted.csv; WoS_03_DaviesEtAlOriginalRayyanFormatted.csv",Cited by: 8; All Open Access; Hybrid Gold Open Access,copulation; courtship; display behavior; learning; lek; mate choice; mating success; passerine; s...,NA,NA,Aleksandra
10.1098/rsbl.2010.0519,rayyan-471509482,Male response to historical and geographical variation in bird song,2011,2,NA,BIOLOGY LETTERS,1744-9561,7,1,57-59,"Derryberry, Elizabeth P.",NA,NA,NA,NA,"In many species, individuals discriminate among sexual signals of conspecific populations in the contexts of mate choice and male-male competition. Differences in signals among populations (geographical variation) are in part the result of signal evolution within populations (temporal variation). Understanding the relative effect of temporal and geographical signal variation on signal salience may therefore provide insight into the evolution of behavioural discrimination. However, no study, to my knowledge, has compared behavioural response to historical signals with response to current signal variation among populations. Here, I measured the response of male white-crowned sparrows (Zonotrichia leucophrys) to historical songs compared with current songs from their local population, a nearby non-local population and a distant population. Males responded most strongly to current local songs, less, but equally, to historical local and current non-local songs, and least to songs of the distant population. Moreover, response to both temporal and geographical variation in song was proportional to how much songs differed acoustically from current local songs. Signal evolution on an ecological time scale appears to have an effect on signal salience comparable to differences found between current neighbouring populations, supporting the idea that behavioural discrimination among learned signals of conspecific populations can evolve relatively rapidly. | WoS_03_DaviesEtAlOriginalRayyanFormatted.csv",NA,NA,NA,NA,Aleksandra
10.1073/pnas.87.15.5749,rayyan-471507508,FEMALE COPYING INCREASES THE VARIANCE IN MALE MATING SUCCESS,1990,8,NA,PROCEEDINGS OF THE NATIONAL ACADEMY OF SCIENCES OF THE UNITED STATES OF AMERICA,0027-8424,87,15,5749-5753,"WADE, MJ and PRUETTJONES, SG",NA,NA,NA,NA,"Theoretical models of sexual selection assume that females choose males independently of the actions and choice of other individual females. Variance in male mating sucess in promiscuous species is thus interpreted as a result of phenotypic differences among males which females perceive and to which they respond. Here we show that, if some females copy the behavior of other females in choosing mates, the variance in male mating success and therefore the opportunity for sexual selection is greatly increased. Copying behavior is most likely in non-resource-based harem and lek mating systems but may occur in polygynous, territorial systems as well. It can be shown that copying behavior by females is an adaptive alternative to random choice whenever there is a cost to mate choice. We develop a statistical means of estimating the degree of female copying in natural populations where it occurs. | SCO_04_DaviesEtAlOriginalRayyanFormatted.csv; WoS_01_JonesDuvalOriginalRayyanFormatted.csv; WoS_03_DaviesEtAlOriginalRayyanFormatted.csv",NA,NA,NA,NA,Aleksandra
10.1016/j.anbehav.2022.03.014,rayyan-471507758,Sexual dimorphism in cuticular hydrocarbons and their potential use in mating in a bushcricket with dynamic sex roles,2022,5,NA,ANIMAL BEHAVIOUR,0003-3472,187,NA,245-252,"Hare, Robin M. and Larsdotter-Mellstro, Helena and Simmons, Leigh W.",NA,NA,NA,NA,"Insect cuticular hydrocarbons provide desiccation resistance but may also be used in chemical signalling. Sexually dimorphic hydrocarbon blends, which may be transferred between individuals during copulation, are used especially in mate assessment. However, not all insect species produce sex-specific hydrocarbon blends, and their general utility in mate choice requires study of a broader range of species than is currently available. In the nuptial gift-giving bushcricket Kawanaphila nartee, sex roles vary depending on food availability: when food is scarce, females compete for access to males and their nuptial gifts, and when food is abundant, males compete for access to females. Given the scope for both male and female mate choice in the species, we hypothesized that their cuticular hydrocarbon profiles would differ. We characterized the cuticular hydrocarbon profiles of male and female K. nartee and found significant differences between them. Given the costly nutrient gifts provided by males at mating, we further hypothesized that males might use hydrocarbon residues left by rival males after mating to avoid investing in offspring sired by other males. Although females perfumed with male-derived hydrocarbon blends had lower mating success than control females, the difference was not statistically significant. We discuss the possible mechanisms that might favour the evolution of sexual dimorphism in cuticular hydrocarbon blends in this species. Crown Copyright (c) 2022 Published by Elsevier Ltd on behalf of The Association for the Study of Animal Behaviour. All rights reserved. | WoS_01_JonesDuvalOriginalRayyanFormatted.csv",NA,NA,NA,NA,Aleksandra
10.1111/brv.12954,rayyan-471521422,Social learning in non-grouping animals,2023,NA,NA,Biological Reviews,NA,98,4,1329 - 1344,"Webster, Mike M.",https://www.scopus.com/inward/record.uri?eid=2-s2.0-85152028817&doi=10.1111%2Fbrv.12954&partnerID=40&md5=5d951d823e2a10d844ae0b6759dd9aba,NA,NA,NA,"Social learning is widespread in the animal kingdom and is involved in behaviours from navigation and predator avoidance to mate choice and foraging. While social learning has been extensively studied in group-living species, this article presents a literature review demonstrating that social learning is also seen in a range of non-grouping animals, including arthropods, fishes and tetrapod groups, and in a variety of behavioural contexts. We should not be surprised by this pattern, since non-grouping animals are not necessarily non-social, and stand to benefit from attending to and responding to social information in the same ways that group-living species do. The article goes on to ask what non-grouping species can tell us about the evolution and development of social learning. First, while social learning may be based on the same cognitive processes as other kinds of learning, albeit with social stimuli, sensory organs and brain regions associated with detection and motivation to respond to social information may be under selection. Non-grouping species may provide useful comparison taxa in phylogenetic analyses investigating if and how the social environment drives selection on these input channels. Second, non-grouping species may be ideal candidates for exploring how ontogenetic experience of social cues shapes the development of social learning, allowing researchers to avoid some of the negative welfare implications associated with raising group-living animals under restricted social conditions. Finally, while non-grouping species may be capable of learning socially under experimental conditions, there is a need to consider how non-grouping restricts access to learning opportunities under natural conditions and whether this places a functional constraint on what non-grouping animals actually learn socially in the wild. © 2023 The Author. Biological Reviews published by John Wiley & Sons Ltd on behalf of Cambridge Philosophical Society. | SCO_04_DaviesEtAlOriginalRayyanFormatted.csv; WoS_03_DaviesEtAlOriginalRayyanFormatted.csv",Cited by: 12; All Open Access; Green Accepted Open Access; Green Open Access; Hybrid Gold Open Access,NA,NA,NA,Aleksandra
10.1111/gbb.12124,rayyan-471521708,Plasticity of the mate choice mind: Courtship evokes choice-like brain responses in females from a coercive mating system,2014,NA,NA,"Genes, Brain and Behavior",NA,13,4,365 - 375,"Wang, S. M.T. and Ramsey, Mary E. and Cummings, Molly Elizabeth",https://www.scopus.com/inward/record.uri?eid=2-s2.0-84897964899&doi=10.1111%2Fgbb.12124&partnerID=40&md5=429fb8498183d4e2aab3f3f187041446,NA,NA,NA,"Female mate choice is fundamental to sexual selection, and determining molecular underpinnings of female preference variation is important for understanding mating character evolution. Previously it was shown that whole-brain expression of a synaptic plasticity marker, neuroserpin, positively correlates with mating bias in the female choice poeciliid, Xiphophorus nigrensis, when exposed to conspecific courting males, whereas this relationship is reversed in Gambusia affinis, a mate coercive poeciliid with no courting males. Here we explore whether species-level differences in female behavioral and brain molecular responses represent 'canalized' or 'plastic' traits. We expose female G. affinis to conspecific males and females, as well as coercive and courting male Poecilia latipinna, for preference assays followed by whole-brain gene expression analyses of neuroserpin, egr-1 and early B. We find positive correlations between gene expression and female preference strength during exposure to courting heterospecific males, but a reversed pattern following exposure to coercive heterospecific males. This suggests that the neuromolecular processes associated with female preference behavior are plastic and responsive to different male phenotypes (courting or coercive) rather than a canalized response linked to mating system. Further, we propose that female behavioral plasticity may involve learning because female association patterns shifted with experience. Compared to younger females, we found larger, more experienced females spend less time near coercive males but associate more with males in the presence of courters. We thus suggest a conserved learning-based neuromolecular process underlying the diversity of female mate preference across the mate choice and coercion-driven mating systems. Male phenotype (courter vs. coercer) evokes contrasting gene by behavior responses in female poeciliid brains. © 2014 John Wiley & Sons Ltd and International Behavioural and Neural Genetics Society. | SCO_04_DaviesEtAlOriginalRayyanFormatted.csv; WoS_03_DaviesEtAlOriginalRayyanFormatted.csv",Cited by: 18,neuroserpin; transcription factor Egr 1; early growth response factor 1; fish protein; neuropepti...;Animal; Neuronal Plasticity; Neuropeptides; Serpins; Sex Factors; Species Specificity,NA,NA,Aleksandra
10.1126/science.aaw8012,rayyan-471507485,Comment on ``Cultural flies: Conformist social learning in fruitflies predicts long-lasting mate-choice traditions{''},2019,10,NA,SCIENCE,0036-8075,366,6462,NA,"Thornquist, Stephen C. and Crickmore, Michael A.",NA,NA,NA,NA,"The claims of Danchin et al. (Research Articles, 30 November 2018, p. 1025) regarding long-lasting mate preference based on conformity may result from systematic experimental error. Even if mate copying were a genuine phenomenon, it is unlikely to result in persisting culture in the wild. | SCO_04_DaviesEtAlOriginalRayyanFormatted.csv; WoS_01_JonesDuvalOriginalRayyanFormatted.csv; WoS_03_DaviesEtAlOriginalRayyanFormatted.csv",NA,NA,NA,NA,Aleksandra
