doi,key,title,year,month,day,journal,issn,volume,issue,pages,authors,url,language,publisher,location,abstract,notes,keywords,pubmed_id,pmc_id,screener
10.1037/a0015474,rayyan-471521872,"Microbes, Mating, and Morality: Individual Differences in Three Functional Domains of Disgust",2009,NA,NA,Journal of Personality and Social Psychology,NA,97,1,103 - 122,"Tybur, Joshua M. and Lieberman, Debra L. and Griskevicius, Vladas",https://www.scopus.com/inward/record.uri?eid=2-s2.0-67650389269&doi=10.1037%2Fa0015474&partnerID=40&md5=084dcd8e2db74e37dfd84fa6e24abac4,NA,NA,NA,"What is the function of disgust? Whereas traditional models have suggested that disgust serves to protect the self or neutralize reminders of our animal nature, an evolutionary perspective suggests that disgust functions to solve 3 qualitatively different adaptive problems related to pathogen avoidance, mate choice, and social interaction. The authors investigated this 3-domain model of disgust across 4 studies and examined how sensitivity to these functional domains relates to individual differences in other psychological constructs. Consistent with their predictions, factor analyses demonstrated that disgust sensitivity partitions into domains related to pathogens, sexuality, and morality. Further, sensitivity to the 3 domains showed predictable differentiation based on sex, perceived vulnerability to disease, psychopathic tendencies, and Big 5 personality traits. In exploring these 3 domains of disgust, the authors introduce a new measure of disgust sensitivity. Appreciation of the functional heterogeneity of disgust has important implications for research on individual differences in disgust sensitivity, emotion, clinical impairments, and neuroscience. © 2009 American Psychological Association. | SCO_04_DaviesEtAlOriginalRayyanFormatted.csv",Cited by: 913,adolescent; adult; article; avoidance behavior; emotion; evolution; female; human; individuality;...;Psychological; Morals; Personality Inventory; Psychometrics; Sex Characteristics; Sexual Behavior...,NA,NA,Santiago
10.1016/j.anbehav.2024.01.026,rayyan-471521410,Social reinforcement guides operant behaviour and auditory learning in a songbird,2024,NA,NA,Animal Behaviour,NA,210,NA,127 - 137,"Macêdo-Lima, Matheus and Fernández-Vargas, Marcela and Remage-Healey, Luke",https://www.scopus.com/inward/record.uri?eid=2-s2.0-85186068899&doi=10.1016%2Fj.anbehav.2024.01.026&partnerID=40&md5=9a42edcc09a5b670aca88a6574da49e6,NA,NA,NA,"Motivation to seek social interactions is inherent to all social species. For instance, even with risk of disease transmission in a recent pandemic, humans sought out frequent in-person social interactions. In other social animals, socialization can be prioritized even over water or food consumption. Zebra finches, Taeniopygia guttata, are highly gregarious songbirds widely used in behavioural and physiological research. Songbirds, like humans, are vocal learners during development, which rely on intense auditory learning. Aside from supporting song learning, auditory learning further supports individual identification, mate choice and outcome associations in songbirds. To study auditory learning in a laboratory setting, studies often employ operant paradigms with food restriction and reinforcement and require complete social isolation, which can result in stress and other unintended physiological consequences for social species. Thus, in this work, we designed an operant behavioural method leveraging the sociality of zebra finches for goal-directed behaviours. Our approach relies on visual social reinforcement, without depriving the animals of food or social contact. Using this task, we found that visual social reinforcement was a strong motivational drive for operant behaviour. Motivation was sensitive to familiarity towards the stimulus animal and higher when engaging with a familiar versus a novel individual. We further show that this tool can be used to assess auditory discrimination learning using either songs or synthetic pure tones as stimuli. As birds gained experience in the task, they developed a strategy to maximize reward acquisition in spite of receiving more punishment, i.e. liberal response bias. Our operant paradigm provides an alternative to tasks using food reinforcement and could be applied to a variety of highly social species, such as rodents and nonhuman primates. © 2024 The Association for the Study of Animal Behaviour | SCO_04_DaviesEtAlOriginalRayyanFormatted.csv; WoS_03_DaviesEtAlOriginalRayyanFormatted.csv",Cited by: 0; All Open Access; Green Accepted Open Access; Green Open Access,behavioral response; disease transmission; learning; mate choice; songbird,NA,NA,Santiago
10.1038/s41587-023-01898-2,rayyan-471521420,Advancing artificial intelligence to help feed the world,2023,NA,NA,Nature Biotechnology,NA,41,9,1188 - 1189,"Hayes, Ben J. and Chen, Chensong and Powell, Owen M. and Dinglasan, Eric G. and Villiers, Kira and Kemper, Kathryn E. and Hickey, Lee T.",https://www.scopus.com/inward/record.uri?eid=2-s2.0-85166224904&doi=10.1038%2Fs41587-023-01898-2&partnerID=40&md5=e4070aea4ac4aa2cd1ad1de5fdc52240,NA,NA,NA,NA | SCO_04_DaviesEtAlOriginalRayyanFormatted.csv,Cited by: 22,animal welfare; artificial intelligence; attention network; breeding; comparative study; consumer...,NA,NA,Santiago
10.1006/anbe.1999.1402,rayyan-471522040,'Culture' in quail: Social influences on mate choices of female Coturnix japonica,2000,NA,NA,Animal Behaviour,NA,59,5,975 - 979,"White, David J. and Galef, Bennett G.",https://www.scopus.com/inward/record.uri?eid=2-s2.0-0033836803&doi=10.1006%2Fanbe.1999.1402&partnerID=40&md5=b251af6cd0541a58bced257731bbc4e3,NA,NA,NA,"We have shown previously that after a focal female Japanese quail, Coturnix japonica, sees a conspecific male mating, the focal female's tendency to affiliate and to mate with that male is significantly increased. Here we describe two experiments demonstrating that a focal female quail that has seen a conspecific male mating subsequently shows an enhanced tendency to affiliate not only with that particular male, but also with other males that share his characteristics. The results have important implications for our understanding of the role of social learning in the evolution of male characteristics. (C) 2000 The Association for the Study of Animal Behaviour. | SCO_04_DaviesEtAlOriginalRayyanFormatted.csv",Cited by: 100,behavioral ecology; learning; mate choice; social behavior; Animalia; Coturnix; Coturnix japonica...,NA,NA,Santiago
10.1503/cmaj.061367,rayyan-471521953,Are all the taken men good? An indirect examination of mate-choice copying in humans,2006,NA,NA,CMAJ. Canadian Medical Association Journal,NA,175,12,1573 - 1574,"Eva, Kevin W. and Wood, Timothy J.",https://www.scopus.com/inward/record.uri?eid=2-s2.0-33845629827&doi=10.1503%2Fcmaj.061367&partnerID=40&md5=1312a5ee55276dc15f55f17b1779e43f,NA,NA,NA,NA | SCO_04_DaviesEtAlOriginalRayyanFormatted.csv; WoS_01_JonesDuvalOriginalRayyanFormatted.csv; WoS_03_DaviesEtAlOriginalRayyanFormatted.csv,Cited by: 50; All Open Access; Gold Open Access; Green Accepted Open Access; Green Open Access,adult; article; controlled study; courtship; female; human; marriage; mate choice; polygamy; soci...,NA,NA,Santiago
10.1016/j.physbeh.2010.01.022,rayyan-471521835,Partner preference: Assessing the role of the female goat,2010,NA,NA,Physiology and Behavior,NA,99,5,587 - 591,"Margiasso, Mary E. and Longpre, Kristy M. and Katz, Larry S.",https://www.scopus.com/inward/record.uri?eid=2-s2.0-77950368398&doi=10.1016%2Fj.physbeh.2010.01.022&partnerID=40&md5=dbbee1f1869546beccabb3e662fd6c0d,NA,NA,NA,"For domestic ruminants, the male is thought to have the control over mate choice. The aim of this study was to assess the potential role the female goat plays in choosing a sexual partner. Approach frequency and proximity time to various social or sexual stimuli in a Y-maze apparatus were used as partner preference assessment parameters. Ovariectomized females were either induced into estrus (n=8) or induced into anestrus (n=8) and exposed to various goal stimuli - intact unfamiliar females (estrous and diestrous), intact males, and neutral (empty) in six separate trials. Total arm entries and time spent within one body length of the goal (proximity time - used to calculate preference scores) were recorded for subjects. With a male present, anestrous subjects had significantly more total arm entries than estrous subjects. Estrous subjects showed a significant preference for the male goal (M) versus the estrous female (ES), diestrous female (DS), and empty goals, respectively. Estrous subjects also showed a preference for the ES and DS goals when one goal was left empty. Anestrous subjects showed a preference for the goal containing ES, DS, and M compared to empty goals. They also showed a preference for ES vs. DS. The Y-maze is a tool that can be used to assess sexual and social partner preferences in female goats. The role the female plays in choosing a partner may be much greater than previously considered. © 2010 Elsevier Inc. | SCO_04_DaviesEtAlOriginalRayyanFormatted.csv",Cited by: 5,anestrus; animal behavior; animal experiment; article; controlled study; estrus; female; goat; ma...;Animal; Choice Behavior; Estradiol; Estrous Cycle; Female; Goats; Male; Maze Learning; Ovariectom...;Animal,NA,NA,Santiago
10.1111/eth.12771,rayyan-471509577,Why are female color polymorphisms rare in territorial damselflies?,2018,9,NA,ETHOLOGY,0179-1613,124,9,667-673,"Castillo, Maria Beatriz Cabezas and Grether, Gregory F.",NA,NA,NA,NA,"In nonterritorial damselflies, females often come in multiple color morphs, perhaps because females with rare colors experience reduced sexual harassment, and thus have a frequency-dependent fitness advantage, compared to females of the most common color morph, but such polymorphisms are rare in territorial species. We consider three hypotheses to explain the rarity of female color polymorphisms in territorial species: (a) misdirected male aggression, (b) poor male mate recognition, and (c) low mating harassment rates. The first hypothesis has some empirical support, and can account for the absence of andromorphs (i.e., females that resemble males), but does not explain the absence of multiple heteromorphs. We tested the second hypothesis by presenting females of two novel color morphs (green- or red-banded abdomens) to territorial male Hetaerina capitalis. Females of both novel color morphs elicited fewer sexual responses than control females, and the red morph occasionally elicited aggressive responses. These results indicate that novel female color morphs would experience reduced mating harassment in this species, contradicting the hypothesis that male mate recognition is too poorly developed to reduce harassment of novel female morphs. By process of elimination, the third hypothesis, that harassment rates are too low in territorial species to provide rare female morphs a fitness advantage, is favored, but remains untested. Our findings also suggest that the common practice of color-marking odonates for behavioral research is likely to interfere with mate choice, as has long been known to be the case in birds. | WoS_03_DaviesEtAlOriginalRayyanFormatted.csv",NA,NA,NA,NA,Santiago
10.1098/rspb.2005.3054,rayyan-471521978,Socially transmitted mate preferences in a monogamous bird: A non-genetic mechanism of sexual selection,2005,NA,NA,Proceedings of the Royal Society B: Biological Sciences,NA,272,1567,1053 - 1058,"Swaddle, John P. and Cathey, Mark G. and Correll, Maureen and Hodkinson, Brendan P.",https://www.scopus.com/inward/record.uri?eid=2-s2.0-21744456367&doi=10.1098%2Frspb.2005.3054&partnerID=40&md5=960f29362062fb770e2a83551b4d5eb9,NA,NA,NA,"There is increasing evidence that animals can acquire mate preferences through the use of public information, notably by observing (and copying) the mate preferences of others in the population. If females acquire preferences through social mechanisms, sexual selection could act very rapidly to spread the preference and drive elaboration of the preferred trait (s). Although there are reports of 'mate-choice copying' in polygynous species, there is no clear evidence for this process in monogamous species. Here, we investigated whether adult female zebra finches Taeniopygia guttata can socially acquire sexual preferences for individual males and, in a separate study, for a generalized trait (coloured leg bands) of males. In both studies, test females observed males in two simultaneous conditions: a ('chosen') mixed-sex situation in which a male was paired with a (model) female, and a ('unchosen') same-sex situation in which a male was paired with another male. In the first experiment, after two weeks of females observing males, test females significantly preferred individual males who had been paired with another female (i.e. chosen males). In the second experiment, test females significantly preferred novel males that were wearing the same leg band colour as the apparently chosen males. Our findings are consistent with the conclusion that female zebra finches' mate preferences are altered by public information. Our study implies that mate preferences can spread rapidly through populations by social mechanisms, affecting the strength of sexual selection in a monogamous species. © 2005 The Royal Society. | SCO_04_DaviesEtAlOriginalRayyanFormatted.csv; WoS_01_JonesDuvalOriginalRayyanFormatted.csv; WoS_03_DaviesEtAlOriginalRayyanFormatted.csv",Cited by: 86; All Open Access; Green Accepted Open Access; Green Open Access,imitation; mate choice; monogamy; passerine; preference behavior; social behavior; animal behavio...,NA,NA,Santiago
10.1159/000332051,rayyan-471507594,Detection of Intergenerational Genetic Effects with Application to HLA-B Matching as a Risk Factor for Schizophrenia,2011,NA,NA,HUMAN HEREDITY,0001-5652,72,3,161-172,"Childs, Erica J. and Sobel, Eric M. and Palmer, Christina G. S. and Sinsheimer, Janet S.",NA,NA,NA,NA,"Background and Methods: Association studies using unrelated individuals cannot detect intergenerational genetic effects contributing to disease. To detect these effects, we improve the extended maternal-fetal genotype (EMFG) incompatibility test to estimate any combination of maternal effects, offspring effects, and their interactions at polymorphic loci or multiple SNPs, using any size pedigrees. We explore the advantages of using extended pedigrees rather than nuclear families. We apply our methods to schizophrenia pedigrees to investigate whether the previously associated mother-daughter HLA-B matching is a genuine risk or the result of bias. Results: Simulations demonstrate that using the EMFG test with extended pedigrees increases power and precision, while partitioning extended pedigrees into nuclear families can underestimate intergenerational effects. Application to actual data demonstrates that mother-daughter HLA-B matching remains a schizophrenia risk factor. Furthermore, ascertainment and mate selection biases cannot by themselves explain the observed HLA-B matching and schizophrenia association. Conclusions: Our results demonstrate the power of the EMFG test to examine intergenerational genetic effects, highlight the importance of pedigree rather than case/control or case-mother/controlmother designs, illustrate that pedigrees provide a means to examine alternative, non-causal mechanisms, and they strongly support the hypothesis that HLA-B matching is causally involved in the etiology of schizophrenia in females. Copyright (C) 2011 S. Karger AG, Basel | WoS_01_JonesDuvalOriginalRayyanFormatted.csv",NA,NA,NA,NA,Santiago
10.1016/0273-1223(96)00365-4,rayyan-471507523,A study of WC derived sewer solids,1996,NA,NA,WATER SCIENCE AND TECHNOLOGY,0273-1223,33,9,17-24,"Friedler, E and Brown, DM and Butler, D",NA,NA,NA,NA,"Little is currently known about the nature, quantity or-variability of WC derived sewer solids. This work describes results of a one week domestic WC usage survey in the UK. Specific attention is paid to solid production including faecal matter, toilet paper and sanitary refuse. Significant quantities of solids were found to be produced. The results illustrate distinctive diurnal usage patterns including the surprisingly low evening faecal related flush usage. Weekend usage exceeded week day usage on average, but with reduced morning peaks. Differences between males and females usage were also noted, in particular the much larger toilet paper usage and sanitary refuse disposal associated with females. Copyright (C) 1996 IAWQ. Published by Elsevier Science Ltd | WoS_01_JonesDuvalOriginalRayyanFormatted.csv","IAWQ International Specialized Conference on Sewer Solids - Characteristics, Movement, Effects and Control, DUNDEE, SCOTLAND, SEP 06-08, 1995",NA,NA,NA,Santiago
10.1016/j.beproc.2007.11.004,rayyan-471521924,Discrimination: From behaviour to brain,2008,NA,NA,Behavioural Processes,NA,77,2,285 - 297,"Phillmore, Leslie S.",https://www.scopus.com/inward/record.uri?eid=2-s2.0-39149111564&doi=10.1016%2Fj.beproc.2007.11.004&partnerID=40&md5=9c546abe2f2a1aa514c95826418dcf4d,NA,NA,NA,"Discrimination is a skill needed by many organisms for survival: decisions about food, shelter, and mate selection all require the ability to distinguish among stimuli. This article reviews the how and why of discrimination and how researchers may exploit this natural skill in the laboratory to learn more about what features of stimuli animals use to discriminate. The paper then discusses the possible neurophysiological basis of discrimination and proposes a model, based on one of stimulus-association put forth by Beninger and Gerdjikov (2004) [Beninger, R.J., Gerdjikov, T.V., 2004. The role of signaling molecules in reward-related incentive learning. Neurotox. Res., 6, 91-104], to account for the role of dopamine in how an animal learns to discriminate rewarded from non-rewarded stimuli. © 2007 Elsevier B.V. All rights reserved. | SCO_04_DaviesEtAlOriginalRayyanFormatted.csv",Cited by: 11,animal; behavior; brain; learning; perception; survival; animal behavior; article; food; laborato...;Neurological; Animalia,NA,NA,Santiago
10.1007/s12110-014-9202-7,rayyan-471521687,I want what she's having: evidence of human mate copying,2014,NA,NA,"Human nature (Hawthorne, N.Y.)",NA,25,3,342 - 358,"Anderson, Ryan Corley and Surbey, Michele K.",https://www.scopus.com/inward/record.uri?eid=2-s2.0-85028224987&doi=10.1007%2Fs12110-014-9202-7&partnerID=40&md5=80a73b1bef9ffb2a5908ef928e41c493,NA,NA,NA,"A variety of non-human females do not select male partners independently. Instead they favor males having previous associations with other females, a phenomenon known as mate copying. This paper investigates whether humans also exhibit mate copying and whether consistent positive information about a man's mate value, and a woman's age and self-perceived mate value (SPMV), influence her tendency to copy the mate choices of others. Female university students (N = 123) rated the desirability of photographed men pictured alone or with one, two, or five women represented by silhouettes. In accordance with the visual arrays, men were described as currently in a romantic relationship; having previously been in one, two, or five relationships; or not having had a romantic relationship in the past 4 years. Women generally rated men pictured with one or two previous partners as more desirable than those with none. Men depicted with five previous partners, however, were found to be less desirable. Younger, presumably less experienced women had a greater tendency to mate copy compared with older women, but high SPMV did not predict greater levels of mate copying. The findings reaffirmed and expanded those suggesting that women do not make mate choices independently. | SCO_04_DaviesEtAlOriginalRayyanFormatted.csv; WoS_01_JonesDuvalOriginalRayyanFormatted.csv",Cited by: 23,adolescent; adult; female; human; imitation; male; photostimulation; psychology; sexual behavior;...,NA,NA,Santiago
10.1016/j.beproc.2012.02.010,rayyan-471521762,Computational mate choice: Theory and empirical evidence,2012,NA,NA,Behavioural Processes,NA,90,2,261 - 277,"Castellano, Sergio and Cadeddu, Giorgia and Cermelli, P.",https://www.scopus.com/inward/record.uri?eid=2-s2.0-84860528125&doi=10.1016%2Fj.beproc.2012.02.010&partnerID=40&md5=c52a3b8fcac28e4d859126cdc0e6687c,NA,NA,NA,"The present review is based on the thesis that mate choice results from information-processing mechanisms governed by computational rules and that, to understand how females choose their mates, we should identify which are the sources of information and how they are used to make decisions. We describe mate choice as a three-step computational process and for each step we present theories and review empirical evidence. The first step is a perceptual process. It describes the acquisition of evidence, that is, how females use multiple cues and signals to assign an attractiveness value to prospective mates (the preference function hypothesis). The second step is a decisional process. It describes the construction of the decision variable (DV), which integrates evidence (private information by direct assessment), priors (public information), and value (perceived utility) of prospective mates into a quantity that is used by a decision rule (DR) to produce a choice. We make the assumption that females are optimal Bayesian decision makers and we derive a formal model of DV that can explain the effects of preference functions, mate copying, social context, and females' state and condition on the patterns of mate choice. The third step of mating decision is a deliberative process that depends on the DRs. We identify two main categories of DRs (absolute and comparative rules), and review the normative models of mate sampling tactics associated to them. We highlight the limits of the normative approach and present a class of computational models (sequential-sampling models) that are based on the assumption that DVs accumulate noisy evidence over time until a decision threshold is reached. These models force us to rethink the dichotomy between comparative and absolute decision rules, between discrimination and recognition, and even between rational and irrational choice. Since they have a robust biological basis, we think they may represent a useful theoretical tool for behavioural ecologist interested in integrating proximate and ultimate causes of mate choice. © 2012 Elsevier B.V. | SCO_04_DaviesEtAlOriginalRayyanFormatted.csv; WoS_01_JonesDuvalOriginalRayyanFormatted.csv; WoS_03_DaviesEtAlOriginalRayyanFormatted.csv",Cited by: 32; All Open Access; Green Accepted Open Access; Green Open Access,Bayesian analysis; behavioral ecology; decision making; ecological modeling; empirical analysis; ...;Animal; Models;Biological; Recognition (Psychology),NA,NA,Santiago
10.1642/AUK-15-162.1,rayyan-471509498,Vocal imitation of mother's calls by begging Red-backed Fairywren nestlings increases parental provisioning,2016,4,NA,AUK,0004-8038,133,2,273-285,"Colombelli-Negrel, Diane and Webster, Michael S. and Dowling, Jenelle L. and Hauber, Mark E. and Kleindorfer, Sonia",NA,NA,NA,NA,"Prenatal imitative learning is an emerging research area in both human and non-human animals. Previous studies in Superb Fairywrens (Malurus cyaneus) showed that mothers are vocal tutors to their embryos and that better imitation of maternal calls yields more parental provisions after hatching. To begin to test if such adaptive behavior is widespread amongst Australasian wrens in Maluridae, we investigated maternal in-nest calling patterns in Red-backed Fairywrens (Malurus melanocephalus). We first compared the structure of maternal and nestling call elements. Next, we examined how in-nest calling behavior varied with parental behaviors and ecological contexts (i.e. prevalence of brood parasitism and nest predation). All Red-backed Fairywren females called to their eggs during incubation and they continued to do so for several days after hatching at a lower rate. Embryos that received more calls per hour during the incubation period (but not the nestling period) developed into hatchlings with higher call element similarity between mother and young. Female call rate was mostly independent of nest predation but in years with more interspecific brood parasitism, nestling element similarity was greater and female call rates tended to be higher. Playback experiments showed that broods with higher element similarity to their mother received more successful feeds. The potential for prenatal tutoring and imitative begging calls in 2 related fairywren taxa sets the stage for a full-scale comparative analysis of the evolution and function of these behaviors across Maluridae and in other vocal-learning lineages. | WoS_03_DaviesEtAlOriginalRayyanFormatted.csv",NA,NA,NA,NA,Santiago
